{
  "site_settings": {
    "site_title": "Alexandra Reinhardt",
    "meta_description": "Senior backend engineer in Berlin working on distributed systems, payment infrastructure and developer platforms.",
    "primary_color": "#1E4FD8",
    "accent_color": "#0EA5A4",
    "default_locale": "en",
    "show_photo": true,
    "show_personal_details": true,
    "show_references": true,
    "show_hobbies": true
  },
  "profile": {
    "full_name": "Alexandra Reinhardt",
    "headline": "Senior Backend Engineer — distributed systems & developer platforms",
    "tagline": "I make slow systems fast and complicated systems boring.",
    "summary_short": "Senior backend engineer with eight years building payment and data infrastructure at scale. I care about the unglamorous parts: migrations that don't page anyone, APIs teams actually enjoy using, and latency budgets that hold under load.",
    "summary_long": "I've spent most of my career on the systems that sit underneath the product — payment ledgers, event pipelines, internal platforms. The work I'm proudest of is rarely visible: a migration that moved 400 million rows with zero downtime, a deploy pipeline that took releases from weekly to twelve a day.\n\nI work best on teams that treat operability as a feature. I write the runbook before the launch, I instrument before I optimise, and I believe a system nobody can debug at 3am is not finished.\n\nCurrently based in Berlin, working across German and international teams.",
    "date_of_birth": "1993-04-18",
    "place_of_birth": "Hamburg, Germany",
    "nationality": "German",
    "marital_status": "Single",
    "current_city": "Berlin",
    "country": "Germany",
    "willing_to_relocate": true,
    "work_authorisation": "EU citizen — no sponsorship required",
    "email": "alexandra@example.com",
    "phone": "+49 30 12345678",
    "availability": "Open to senior and staff roles from March 2026",
    "years_experience": 8
  },
  "social_links": [
    {
      "platform": "GitHub",
      "url": "https://github.com/example",
      "icon": "github"
    },
    {
      "platform": "LinkedIn",
      "url": "https://linkedin.com/in/example",
      "icon": "linkedin"
    },
    {
      "platform": "Mastodon",
      "url": "https://hachyderm.io/@example",
      "icon": "mastodon"
    },
    {
      "platform": "Email",
      "url": "mailto:alexandra@example.com",
      "icon": "mail"
    }
  ],
  "skill_categories": [
    {
      "name": "Languages",
      "icon": "code",
      "skills": [
        {
          "name": "Python",
          "proficiency": 5,
          "years_experience": 8,
          "is_featured": true
        },
        {
          "name": "Go",
          "proficiency": 4,
          "years_experience": 4,
          "is_featured": true
        },
        {
          "name": "TypeScript",
          "proficiency": 4,
          "years_experience": 5,
          "is_featured": true
        },
        {
          "name": "SQL",
          "proficiency": 5,
          "years_experience": 8,
          "is_featured": true
        },
        {
          "name": "Rust",
          "proficiency": 2,
          "years_experience": 1
        }
      ]
    },
    {
      "name": "Backend & data",
      "icon": "server",
      "skills": [
        {
          "name": "Django",
          "proficiency": 5,
          "years_experience": 7,
          "is_featured": true
        },
        {
          "name": "FastAPI",
          "proficiency": 4,
          "years_experience": 3
        },
        {
          "name": "PostgreSQL",
          "proficiency": 5,
          "years_experience": 8,
          "is_featured": true
        },
        {
          "name": "Kafka",
          "proficiency": 4,
          "years_experience": 4
        },
        {
          "name": "Redis",
          "proficiency": 4,
          "years_experience": 6
        },
        {
          "name": "Elasticsearch",
          "proficiency": 3,
          "years_experience": 3
        }
      ]
    },
    {
      "name": "Infrastructure",
      "icon": "cloud",
      "skills": [
        {
          "name": "Kubernetes",
          "proficiency": 4,
          "years_experience": 5,
          "is_featured": true
        },
        {
          "name": "Terraform",
          "proficiency": 4,
          "years_experience": 4
        },
        {
          "name": "AWS",
          "proficiency": 4,
          "years_experience": 6,
          "is_featured": true
        },
        {
          "name": "Docker",
          "proficiency": 5,
          "years_experience": 7
        },
        {
          "name": "GitHub Actions",
          "proficiency": 4,
          "years_experience": 5
        }
      ]
    },
    {
      "name": "Observability",
      "icon": "activity",
      "skills": [
        {
          "name": "Prometheus",
          "proficiency": 4,
          "years_experience": 5
        },
        {
          "name": "Grafana",
          "proficiency": 4,
          "years_experience": 5
        },
        {
          "name": "OpenTelemetry",
          "proficiency": 3,
          "years_experience": 2
        },
        {
          "name": "Sentry",
          "proficiency": 4,
          "years_experience": 5
        }
      ]
    },
    {
      "name": "Frontend",
      "icon": "layout",
      "skills": [
        {
          "name": "React",
          "proficiency": 3,
          "years_experience": 4
        },
        {
          "name": "Tailwind CSS",
          "proficiency": 3,
          "years_experience": 3
        },
        {
          "name": "Vite",
          "proficiency": 3,
          "years_experience": 2
        }
      ]
    },
    {
      "name": "Ways of working",
      "icon": "users",
      "skills": [
        {
          "name": "Technical mentoring",
          "proficiency": 5,
          "years_experience": 5,
          "is_featured": true
        },
        {
          "name": "Incident response",
          "proficiency": 5,
          "years_experience": 6
        },
        {
          "name": "Architecture review",
          "proficiency": 4,
          "years_experience": 4
        },
        {
          "name": "Technical writing",
          "proficiency": 4,
          "years_experience": 6
        },
        {
          "name": "Agile / Scrum",
          "proficiency": 4,
          "years_experience": 8
        },
        {
          "name": "Hiring & interviewing",
          "proficiency": 3,
          "years_experience": 3
        }
      ]
    }
  ],
  "experience": [
    {
      "company": "Nordbank Digital",
      "company_url": "https://example.com",
      "role": "Senior Backend Engineer",
      "employment_type": "full_time",
      "location": "Berlin, Germany",
      "is_remote": false,
      "start_date": "2022-09-01",
      "end_date": null,
      "is_current": true,
      "description": "Technical lead for the payments ledger — the system of record for every transaction in the bank. Four engineers, one very unforgiving uptime target.",
      "highlights": [
        "Led the zero-downtime migration of a 400M-row ledger from a single Postgres instance to a partitioned cluster, with no customer-visible interruption.",
        "Cut p99 transaction-settlement latency from 840ms to 210ms by replacing synchronous fan-out with a Kafka event pipeline.",
        "Introduced contract testing between eight internal services, which took integration-caused incidents from roughly two a month to two in a year.",
        "Mentored three engineers from mid to senior, two of whom now lead their own teams."
      ],
      "skills": [
        "Python",
        "Go",
        "PostgreSQL",
        "Kafka",
        "Kubernetes",
        "Incident response"
      ]
    },
    {
      "company": "Fleetwise GmbH",
      "company_url": "https://example.com",
      "role": "Backend Engineer",
      "employment_type": "full_time",
      "location": "Munich, Germany",
      "is_remote": true,
      "start_date": "2020-02-01",
      "end_date": "2022-08-31",
      "is_current": false,
      "description": "Built the telemetry ingestion platform for a commercial-vehicle fleet product, processing roughly 1.2 billion sensor events a day at peak.",
      "highlights": [
        "Designed the ingestion pipeline that took the platform from 40M to 1.2B daily events without a proportional increase in infrastructure spend.",
        "Reduced storage costs 38% by introducing tiered retention and columnar rollups.",
        "Wrote the on-call runbook and ran the incident-review process for two years."
      ],
      "skills": [
        "Python",
        "Kafka",
        "AWS",
        "Terraform",
        "Prometheus"
      ]
    },
    {
      "company": "Helix Commerce",
      "company_url": "https://example.com",
      "role": "Software Engineer",
      "employment_type": "full_time",
      "location": "Hamburg, Germany",
      "is_remote": false,
      "start_date": "2018-07-01",
      "end_date": "2020-01-31",
      "is_current": false,
      "description": "Full-stack work on a B2B e-commerce platform serving around 300 wholesale customers across the DACH region.",
      "highlights": [
        "Rebuilt the order-import pipeline, cutting a nightly four-hour batch job to under twelve minutes.",
        "Shipped the customer-facing pricing API still in production today."
      ],
      "skills": [
        "Python",
        "Django",
        "PostgreSQL",
        "React"
      ]
    },
    {
      "company": "Technische Universität Berlin",
      "company_url": "https://example.com",
      "role": "Working Student — Distributed Systems Group",
      "employment_type": "working_student",
      "location": "Berlin, Germany",
      "is_remote": false,
      "start_date": "2016-10-01",
      "end_date": "2018-03-31",
      "is_current": false,
      "description": "Research support on consensus-protocol benchmarking, alongside my Master's.",
      "highlights": [